{
  "schema": "MythosHostActivation/2.0",
  "secret_free": true,
  "plan_sha256": "be5fb13a526f1a6110345a5ee1ce1f22c16c8872f9ad8602577fb35aaa8cd31c",
  "operator_approval": "pending",
  "approval_manifest_sha256": null,
  "activation_status": "planned",
  "local_binding_policy": "boolean capability presence only; values and credentials remain in ignored local configuration",
  "entries": [
    {
      "id": "git-hooks",
      "kind": "git-hooks",
      "selection": "selected",
      "not_applicable_reason": null,
      "binding": null,
      "prerequisites": [
        "git",
        ".githooks/pre-push"
      ],
      "backup": [
        {
          "op": "backup-git-config",
          "args": [
            "core.hooksPath"
          ]
        }
      ],
      "preflight": [
        {
          "op": "assert-file",
          "args": [
            ".githooks/pre-push"
          ]
        },
        {
          "op": "run",
          "args": [
            "npm",
            "run",
            "verify:parity"
          ]
        }
      ],
      "install": [
        {
          "op": "git-config-set",
          "args": [
            "core.hooksPath",
            ".githooks"
          ]
        }
      ],
      "kickstart": [],
      "healthcheck": [
        {
          "op": "git-config-equals",
          "args": [
            "core.hooksPath",
            ".githooks"
          ]
        }
      ],
      "rollback": [
        {
          "op": "restore-git-config",
          "args": [
            "core.hooksPath"
          ]
        }
      ],
      "receipt": "_dev/state/host-activation/receipts/git-hooks.json"
    },
    {
      "id": "claude-project-hooks",
      "kind": "project-hooks",
      "selection": "selected",
      "not_applicable_reason": null,
      "binding": null,
      "prerequisites": [
        "node",
        ".claude/settings.json",
        "hook-event:PostToolUse",
        "hook-event:PreToolUse",
        "hook-event:SessionEnd",
        "hook-event:SessionStart",
        "hook-event:Stop",
        "hook-event:SubagentStop",
        "hook-event:UserPromptSubmit"
      ],
      "backup": [
        {
          "op": "backup-file",
          "args": [
            ".claude/settings.json"
          ]
        }
      ],
      "preflight": [
        {
          "op": "validate-project-hooks",
          "args": [
            "PostToolUse",
            "PreToolUse",
            "SessionEnd",
            "SessionStart",
            "Stop",
            "SubagentStop",
            "UserPromptSubmit"
          ]
        }
      ],
      "install": [
        {
          "op": "no-op",
          "args": [
            "repository-local hooks require no host copy"
          ]
        }
      ],
      "kickstart": [],
      "healthcheck": [
        {
          "op": "validate-project-hooks",
          "args": [
            "PostToolUse",
            "PreToolUse",
            "SessionEnd",
            "SessionStart",
            "Stop",
            "SubagentStop",
            "UserPromptSubmit"
          ]
        }
      ],
      "rollback": [
        {
          "op": "restore-file",
          "args": [
            ".claude/settings.json"
          ]
        }
      ],
      "receipt": "_dev/state/host-activation/receipts/claude-project-hooks.json"
    },
    {
      "id": "launchd-delesign-poll",
      "kind": "launchd",
      "selection": "not_applicable",
      "not_applicable_reason": "local binding \"delesign\" is absent",
      "binding": "delesign",
      "prerequisites": [
        "node",
        "launchctl",
        "plutil",
        "tools/launchd/run-delesign-poll.cjs"
      ],
      "backup": [
        {
          "op": "backup-launchd-plist",
          "args": [
            "delesign-poll"
          ]
        }
      ],
      "preflight": [
        {
          "op": "run",
          "args": [
            "tools/launchd/install.sh",
            "delesign-poll",
            "--dry-run"
          ]
        }
      ],
      "install": [
        {
          "op": "run",
          "args": [
            "tools/launchd/install.sh",
            "delesign-poll"
          ]
        }
      ],
      "kickstart": [
        {
          "op": "launchctl-kickstart",
          "args": [
            "org.mythos.portable.delesign-poll"
          ]
        }
      ],
      "healthcheck": [
        {
          "op": "launchctl-print",
          "args": [
            "org.mythos.portable.delesign-poll"
          ]
        }
      ],
      "rollback": [
        {
          "op": "rollback-launchd",
          "args": [
            "delesign-poll"
          ]
        }
      ],
      "receipt": "_dev/state/host-activation/receipts/launchd-delesign-poll.json"
    },
    {
      "id": "launchd-framework-flywheel",
      "kind": "launchd",
      "selection": "selected",
      "not_applicable_reason": null,
      "binding": null,
      "prerequisites": [
        "node",
        "launchctl",
        "plutil",
        "tools/launchd/run-framework-flywheel.cjs"
      ],
      "backup": [
        {
          "op": "backup-launchd-plist",
          "args": [
            "framework-flywheel"
          ]
        }
      ],
      "preflight": [
        {
          "op": "run",
          "args": [
            "tools/launchd/install.sh",
            "framework-flywheel",
            "--dry-run"
          ]
        }
      ],
      "install": [
        {
          "op": "run",
          "args": [
            "tools/launchd/install.sh",
            "framework-flywheel"
          ]
        }
      ],
      "kickstart": [
        {
          "op": "launchctl-kickstart",
          "args": [
            "org.mythos.portable.framework-flywheel"
          ]
        }
      ],
      "healthcheck": [
        {
          "op": "launchctl-print",
          "args": [
            "org.mythos.portable.framework-flywheel"
          ]
        }
      ],
      "rollback": [
        {
          "op": "rollback-launchd",
          "args": [
            "framework-flywheel"
          ]
        }
      ],
      "receipt": "_dev/state/host-activation/receipts/launchd-framework-flywheel.json"
    },
    {
      "id": "launchd-hygiene-sweep",
      "kind": "launchd",
      "selection": "selected",
      "not_applicable_reason": null,
      "binding": null,
      "prerequisites": [
        "node",
        "launchctl",
        "plutil",
        "tools/launchd/run-hygiene-sweep.cjs"
      ],
      "backup": [
        {
          "op": "backup-launchd-plist",
          "args": [
            "hygiene-sweep"
          ]
        }
      ],
      "preflight": [
        {
          "op": "run",
          "args": [
            "tools/launchd/install.sh",
            "hygiene-sweep",
            "--dry-run"
          ]
        }
      ],
      "install": [
        {
          "op": "run",
          "args": [
            "tools/launchd/install.sh",
            "hygiene-sweep"
          ]
        }
      ],
      "kickstart": [
        {
          "op": "launchctl-kickstart",
          "args": [
            "org.mythos.portable.hygiene-sweep"
          ]
        }
      ],
      "healthcheck": [
        {
          "op": "launchctl-print",
          "args": [
            "org.mythos.portable.hygiene-sweep"
          ]
        }
      ],
      "rollback": [
        {
          "op": "rollback-launchd",
          "args": [
            "hygiene-sweep"
          ]
        }
      ],
      "receipt": "_dev/state/host-activation/receipts/launchd-hygiene-sweep.json"
    },
    {
      "id": "launchd-harness-capability-crawler",
      "kind": "launchd",
      "selection": "selected",
      "not_applicable_reason": null,
      "binding": null,
      "prerequisites": [
        "node",
        "launchctl",
        "plutil",
        "tools/launchd/run-harness-capability-crawler.cjs"
      ],
      "backup": [
        {
          "op": "backup-launchd-plist",
          "args": [
            "harness-capability-crawler"
          ]
        }
      ],
      "preflight": [
        {
          "op": "run",
          "args": [
            "tools/launchd/install.sh",
            "harness-capability-crawler",
            "--dry-run"
          ]
        }
      ],
      "install": [
        {
          "op": "run",
          "args": [
            "tools/launchd/install.sh",
            "harness-capability-crawler"
          ]
        }
      ],
      "kickstart": [
        {
          "op": "launchctl-kickstart",
          "args": [
            "org.mythos.portable.harness-capability-crawler"
          ]
        }
      ],
      "healthcheck": [
        {
          "op": "launchctl-print",
          "args": [
            "org.mythos.portable.harness-capability-crawler"
          ]
        }
      ],
      "rollback": [
        {
          "op": "rollback-launchd",
          "args": [
            "harness-capability-crawler"
          ]
        }
      ],
      "receipt": "_dev/state/host-activation/receipts/launchd-harness-capability-crawler.json"
    },
    {
      "id": "launchd-harness-sync-crawler",
      "kind": "launchd",
      "selection": "selected",
      "not_applicable_reason": null,
      "binding": null,
      "prerequisites": [
        "node",
        "launchctl",
        "plutil",
        "tools/launchd/run-harness-sync-crawler.cjs"
      ],
      "backup": [
        {
          "op": "backup-launchd-plist",
          "args": [
            "harness-sync-crawler"
          ]
        }
      ],
      "preflight": [
        {
          "op": "run",
          "args": [
            "tools/launchd/install.sh",
            "harness-sync-crawler",
            "--dry-run"
          ]
        }
      ],
      "install": [
        {
          "op": "run",
          "args": [
            "tools/launchd/install.sh",
            "harness-sync-crawler"
          ]
        }
      ],
      "kickstart": [
        {
          "op": "launchctl-kickstart",
          "args": [